City Commission on Human Rights,cpuiptuser000101@mailinator.com
Department of Education,cpuiptuser000131@mailinator.com
Department of Information Technology and Telecommunications,cpuiptuser000161@mailinator.com
Department of Records and Information Services,cpuiptuser000191@mailinator.com
Mayor's Office of Contract Services,cpuiptuser000221@mailinator.com
Mayor's Office of Media and Entertainment,cpuiptuser000251@mailinator.com
Office of Administrative Trials and Hearings,cpuiptuser000281@mailinator.com
Office of the Chief Medical Examiner,cpuiptuser000311@mailinator.com
Office of Emergency Management,cpuiptuser000341@mailinator.com
